{
  "event_id": "evt_20260524_01",
  "event_type": "ParsePreviewRequested",
  "event_version": 1,
  "schema_version": "2026-05-24",
  "tenant_id": "tnt_default",
  "aggregate_type": "source_file",
  "aggregate_id": "src_20260524_01",
  "sequence": 1,
  "occurred_at": "2026-05-24T00:00:00Z",
  "producer": "intake-pipeline",
  "trace_id": "trc_20260524_01",
  "payload": {
    "request_id": "ppr_20260524_01",
    "tenant_id": "tnt_default",
    "collection_id": "col_policy",
    "source_file_id": "src_20260524_01",
    "source_binary_ref": "s3://bucket/source/expense-policy.pdf",
    "filename": "expense-policy.pdf",
    "mime_type": "application/pdf",
    "parser_profile_id": "parser_default",
    "trace_id": "trc_20260524_01"
  }
}
