{
  "event_id": "evt_20260524_02",
  "event_type": "ParseSnapshotReady",
  "event_version": 1,
  "schema_version": "2026-05-24",
  "tenant_id": "tnt_default",
  "aggregate_type": "parse_snapshot",
  "aggregate_id": "pss_20260524_01",
  "sequence": 1,
  "occurred_at": "2026-05-24T00:00:00Z",
  "producer": "indexing",
  "trace_id": "trc_20260524_01",
  "payload": {
    "parse_snapshot_id": "pss_20260524_01",
    "source_file_id": "src_20260524_01",
    "tenant_id": "tnt_default",
    "collection_id": "col_policy",
    "parser_backend": "ragflow-deepdoc",
    "parser_profile_id": "parser_default",
    "preview_text_ref": "s3://bucket/parse-snapshots/pss_20260524_01/preview.txt",
    "chunk_preview_ref": "s3://bucket/parse-snapshots/pss_20260524_01/chunks.json",
    "warnings": [],
    "trace_id": "trc_20260524_01"
  }
}
