{
  "event_id": "evt_20260523_04",
  "event_type": "RetrievalExecuted",
  "event_version": 1,
  "schema_version": "2026-05-23",
  "tenant_id": "tnt_default",
  "aggregate_type": "query",
  "aggregate_id": "qry_20260523_01",
  "sequence": 1,
  "occurred_at": "2026-05-23T02:00:00Z",
  "producer": "retrieval",
  "trace_id": "trc_20260523_query_01",
  "payload": {
    "query_id": "qry_20260523_01",
    "tenant_id": "tnt_default",
    "principal_id": "usr_finance_01",
    "collection_scope": [
      "col_policy",
      "col_handbook"
    ],
    "profile_id": "ret_default",
    "index_version_used": [
      "idxv_col_policy_active"
    ],
    "latency_ms": 42,
    "top_chunk_ids": [
      "chk_doc_expense_policy_idxv_col_policy_active_0001"
    ],
    "debug_ref": "dbg://retrieval/qry_20260523_01"
  }
}
